{
  "paper_profile": {
    "file_name": "sample_paper_with_errors.docx",
    "source_format": "docx",
    "paper_type": "经管类实证论文",
    "data_type": "面板数据",
    "sample_object": "中国 30 个省级行政区",
    "sample_period": "2011—2022",
    "detected_methods": [
      "面板固定效应",
      "熵值法",
      "中介效应"
    ],
    "trigger_plan": {
      "triggered_rule_groups": [
        "non_model_topic_rules",
        "non_model_literature_rules",
        "non_model_data_variable_rules",
        "non_model_structure_norm_rules",
        "model_general_empirical_rules",
        "model_panel_rules",
        "model_mediation_rules",
        "model_entropy_index_rules"
      ],
      "not_applicable_rule_groups": [
        "model_did_rules",
        "model_iv_rules",
        "model_logit_probit_rules",
        "model_questionnaire_scale_rules",
        "model_case_analysis_rules"
      ],
      "manual_confirmation_items": [
        "回归表#3 部分列疑似为图片嵌入，需人工确认标准误处理"
      ]
    }
  },
  "overall_risk_level": "高风险",
  "summary_counts": {
    "pass": 6,
    "red": 4,
    "yellow": 8,
    "green": 3,
    "manual": 2,
    "na": 5
  },
  "pass_items": [
    {
      "id": "PASS-01",
      "domain": "选题与研究问题质检",
      "text": "题目已体现研究对象与核心变量",
      "evidence": "段落#1：《数字经济对区域共同富裕的影响研究——基于中国省级面板数据》"
    },
    {
      "id": "PASS-02",
      "domain": "文献综述与理论链条质检",
      "text": "文献综述已按主题分类",
      "evidence": "段落#28—段落#42：分为数字经济文献、共同富裕文献、二者关系文献三类"
    },
    {
      "id": "PASS-03",
      "domain": "数据、变量与口径质检",
      "text": "已呈现变量定义表",
      "evidence": "表格#1：包含被解释变量、核心解释变量、控制变量"
    },
    {
      "id": "PASS-04",
      "domain": "方法模型与实证结果质检",
      "text": "已呈现模型方程与固定效应设定",
      "evidence": "段落#78：Y_{it} = α + βX_{it} + γZ_{it} + μ_i + λ_t + ε_{it}"
    },
    {
      "id": "PASS-05",
      "domain": "结构表达与学术规范质检",
      "text": "中英文摘要与关键词均已呈现",
      "evidence": "段落#3—段落#7"
    },
    {
      "id": "PASS-06",
      "domain": "方法模型与实证结果质检",
      "text": "已包含基准回归、稳健性、机制分析三层结构",
      "evidence": "表格#3、表格#4、表格#5"
    }
  ],
  "issues": [
    {
      "issue_id": "SN-001",
      "rule_id": "SN-ABSTRACT-EN-001",
      "domain": "结构表达与学术规范质检",
      "level": "红色",
      "issue_type": "中英文摘要关键信息不一致",
      "location": "中文摘要段落#3；英文摘要段落#5",
      "evidence": "中文写“样本期间 2011—2022 年”；英文写“from 2012 to 2022”",
      "evidence_strength": "强",
      "explanation": "样本期间的中英表述不一致，属于第 9bis 节红色硬伤强制清单第 4 项：中英文摘要关键信息不一致。",
      "suggestion": "建议建立中英文摘要对照表，统一样本期间、研究对象、方法与结论表述。",
      "need_manual_confirmation": false,
      "confidence": "高"
    },
    {
      "issue_id": "MM-001",
      "rule_id": "MM-GEN-005",
      "domain": "方法模型与实证结果质检",
      "level": "红色",
      "issue_type": "正文结论超出表格结果支持",
      "location": "结论段落#136；对应表格#3",
      "evidence": "正文写“东部效应最强、中部次之、西部最弱”；表格#3 分组回归系数：东部 0.213***、中部 0.098*、西部 0.312***",
      "evidence_strength": "强",
      "explanation": "文字描述的大小排序（东＞中＞西）与表格实际系数排序（西＞东＞中）不一致，属于第 9bis 节硬伤第 3 项。",
      "suggestion": "建议重新核对分组回归系数并调整正文表述；若基于稳健性另有解释，需在文中显式说明依据的是哪一列。",
      "need_manual_confirmation": false,
      "confidence": "高"
    },
    {
      "issue_id": "DV-001",
      "rule_id": "DV-INDEX-001",
      "domain": "数据、变量与口径质检",
      "level": "红色",
      "issue_type": "熵值法指标体系与权重计算说明不足",
      "location": "指标体系段落#55—段落#62",
      "evidence": "正文提到“采用熵值法构建共同富裕综合指数”，但未呈现指标正负向属性、标准化公式与权重计算公式",
      "evidence_strength": "强",
      "explanation": "熵值法核心步骤缺失，将导致综合指数无法复核，属于影响数据可复核性的核心问题。",
      "suggestion": "建议补充指标体系表（含正负向属性）、min-max 标准化公式、熵值权重公式 wj = (1-ej) / Σ(1-ej) 以及综合得分计算过程。",
      "need_manual_confirmation": false,
      "confidence": "高"
    },
    {
      "issue_id": "MM-002",
      "rule_id": "MM-GEN-003",
      "domain": "方法模型与实证结果质检",
      "level": "红色",
      "issue_type": "相关关系表述为强因果关系",
      "location": "结论段落#138；摘要段落#3",
      "evidence": "结论写“数字经济导致共同富裕水平显著提升”“证明数字经济对共同富裕存在因果作用”",
      "evidence_strength": "强",
      "explanation": "论文使用双向固定效应模型，未采用 DID/IV 等因果识别策略，不宜使用“导致/证明因果”等强因果表述。",
      "suggestion": "建议改为“显著促进”“存在显著正向影响”等稳妥表述；如需保留因果结论，需补充明确的识别策略与局限性讨论。",
      "need_manual_confirmation": false,
      "confidence": "高"
    },
    {
      "issue_id": "TQ-001",
      "rule_id": "TQ-QUESTION-001",
      "domain": "选题与研究问题质检",
      "level": "黄色",
      "issue_type": "研究问题不明确",
      "location": "引言段落#12—段落#18",
      "evidence": "引言前 60% 为宏观政策背景铺陈，末段仅笼统提出“探讨数字经济对共同富裕的影响”，未明确核心机制与研究边界",
      "evidence_strength": "中",
      "explanation": "引言末段研究问题过于宽泛，未落到可回答、可验证的层面。",
      "suggestion": "建议在引言末段用 2—3 个具体问题界定：影响方向如何？通过何种机制？在东中西部是否存在异质性？",
      "need_manual_confirmation": false,
      "confidence": "高"
    },
    {
      "issue_id": "LT-001",
      "rule_id": "LT-REVIEW-001",
      "domain": "文献综述与理论链条质检",
      "level": "黄色",
      "issue_type": "文献综述罗列化",
      "location": "文献综述段落#28—段落#42",
      "evidence": "综述连续使用“XX（2019）认为”“YY（2020）指出”，缺少已有研究不足与本文切入点",
      "evidence_strength": "中",
      "explanation": "文献综述结束后直接进入研究设计，未评述本文相对已有研究的边际贡献。",
      "suggestion": "建议在综述末段补充已有研究不足与本文切入点，说明本文在样本、机制或指标构建上的边际补充。",
      "need_manual_confirmation": false,
      "confidence": "高"
    },
    {
      "issue_id": "DV-002",
      "rule_id": "DV-SAMPLE-001",
      "domain": "数据、变量与口径质检",
      "level": "黄色",
      "issue_type": "样本筛选过程不透明",
      "location": "数据来源段落#48",
      "evidence": "正文直接写“最终得到 330 个省份-年份观测值”，未说明剔除规则与缺失值处理",
      "evidence_strength": "中",
      "explanation": "样本筛选过程不透明，读者无法复核样本口径。",
      "suggestion": "建议增加样本筛选流程表：初始样本 → 剔除原因 → 剔除数量 → 最终样本。",
      "need_manual_confirmation": false,
      "confidence": "高"
    },
    {
      "issue_id": "MM-003",
      "rule_id": "MM-GEN-002",
      "domain": "方法模型与实证结果质检",
      "level": "黄色",
      "issue_type": "模型方程、变量符号或下标说明不完整",
      "location": "模型设定段落#78",
      "evidence": "模型方程已列出，但未说明 i、t 下标含义与误差项聚类假设",
      "evidence_strength": "中",
      "explanation": "变量符号与下标说明不完整，影响模型可解释性。",
      "suggestion": "建议在模型方程下方补充：i 表示省份，t 表示年份；μ_i 为省份固定效应，λ_t 为年度固定效应；ε_{it} 为聚类到省份的稳健标准误。",
      "need_manual_confirmation": false,
      "confidence": "高"
    },
    {
      "issue_id": "MM-004",
      "rule_id": "MM-PANEL-002",
      "domain": "方法模型与实证结果质检",
      "level": "黄色",
      "issue_type": "固定效应与随机效应选择依据不足",
      "location": "模型设定段落#79",
      "evidence": "论文使用双向固定效应但未说明 Hausman 检验或理论依据",
      "evidence_strength": "中",
      "explanation": "未说明选择固定效应的理由。",
      "suggestion": "建议报告 Hausman 检验结果，或从省份异质性角度说明选择个体固定效应的理论依据。",
      "need_manual_confirmation": false,
      "confidence": "高"
    },
    {
      "issue_id": "MM-005",
      "rule_id": "MM-MED-002",
      "domain": "方法模型与实证结果质检",
      "level": "黄色",
      "issue_type": "中介效应结果解释不完整",
      "location": "机制分析段落#108—段落#118",
      "evidence": "论文报告了中介变量回归结果，但未解释 X→M、M→Y、X→Y 的间接效应大小与显著性",
      "evidence_strength": "中",
      "explanation": "中介路径未完整展开。",
      "suggestion": "建议围绕三段式效应解释中介机制：X 对 M（第一阶段）、加入 M 后 X 对 Y（第二阶段），并报告 Sobel 检验或 Bootstrap 结果。",
      "need_manual_confirmation": false,
      "confidence": "高"
    },
    {
      "issue_id": "SN-002",
      "rule_id": "SN-TABLE-001",
      "domain": "结构表达与学术规范质检",
      "level": "黄色",
      "issue_type": "图表注释不完整",
      "location": "表格#3、表格#4、表格#5",
      "evidence": "多张回归表未说明括号内为标准误还是 t 值，也未说明显著性星号含义",
      "evidence_strength": "中",
      "explanation": "回归表注释不完整，影响可读性与规范性。",
      "suggestion": "建议统一在表注中说明：括号内为聚类到省份的稳健标准误；***、**、* 分别代表 1%、5%、10% 显著性水平。",
      "need_manual_confirmation": false,
      "confidence": "高"
    },
    {
      "issue_id": "SN-003",
      "rule_id": "SN-REF-001",
      "domain": "结构表达与学术规范质检",
      "level": "黄色",
      "issue_type": "正文引用与参考文献不一致",
      "location": "正文段落#33、段落#61；参考文献段落#150—段落#182",
      "evidence": "正文引用“Acemoglu (2019)”“陈钊 (2020)”在参考文献中未找到对应条目",
      "evidence_strength": "中",
      "explanation": "存在正文引用未列入参考文献的情况。",
      "suggestion": "建议逐条核对正文引用与文末参考文献，确保双向对应；建议使用 Zotero 或 EndNote 统一管理。",
      "need_manual_confirmation": false,
      "confidence": "高"
    },
    {
      "issue_id": "SN-004",
      "rule_id": "SN-KEYWORDS-001",
      "domain": "结构表达与学术规范质检",
      "level": "绿色",
      "issue_type": "关键词设置不规范",
      "location": "关键词段落#4；英文关键词段落#7",
      "evidence": "中文 5 个关键词、英文 4 个；“数字经济”英文译为“Digital economy”与“digital economy”两种大小写形式",
      "evidence_strength": "弱",
      "explanation": "关键词大小写与顺序未统一。",
      "suggestion": "建议统一英文关键词大小写形式，保留 3—5 个核心关键词。",
      "need_manual_confirmation": false,
      "confidence": "高"
    },
    {
      "issue_id": "SN-005",
      "rule_id": "SN-ADVICE-001",
      "domain": "结构表达与学术规范质检",
      "level": "绿色",
      "issue_type": "政策建议或管理建议套话化",
      "location": "政策建议段落#140—段落#145",
      "evidence": "多次出现“加强”“完善”“提高”“进一步推进”等泛化表述",
      "evidence_strength": "中",
      "explanation": "建议内容缺少具体主体与可执行动作。",
      "suggestion": "建议按“研究发现 → 对应主体 → 具体行动 → 预期效果”的四段式改写政策建议。",
      "need_manual_confirmation": false,
      "confidence": "高"
    },
    {
      "issue_id": "SN-006",
      "rule_id": "SN-LANG-001",
      "domain": "结构表达与学术规范质检",
      "level": "绿色",
      "issue_type": "语言表达、重复或标题错误",
      "location": "全文抽样",
      "evidence": "多处出现“具有一定的重要意义”“在一定程度上”等冗余表达",
      "evidence_strength": "弱",
      "explanation": "语言存在轻微冗余。",
      "suggestion": "建议删除冗余表达，保持学术表达简洁。",
      "need_manual_confirmation": false,
      "confidence": "高"
    },
    {
      "issue_id": "MM-006",
      "rule_id": "MM-GEN-004",
      "domain": "方法模型与实证结果质检",
      "level": "灰色",
      "issue_type": "回归表基本信息不完整",
      "location": "表格#3 第 5—7 列",
      "evidence": "该区域文本抽取为空，疑似图片嵌入",
      "evidence_strength": "弱",
      "explanation": "回归表部分列无法稳定解析，无法核对样本量、R²、固定效应设定。",
      "suggestion": "建议人工确认第 5—7 列是否包含样本量、R²、固定效应说明；若缺失，请补充。",
      "need_manual_confirmation": true,
      "confidence": "高"
    },
    {
      "issue_id": "SN-007",
      "rule_id": "SN-REF-001",
      "domain": "结构表达与学术规范质检",
      "level": "灰色",
      "issue_type": "参考文献格式解析不完整",
      "location": "参考文献段落#150—段落#182",
      "evidence": "参考文献含大量特殊字符与斜体，脚本抽取存在丢字符情况",
      "evidence_strength": "弱",